{
  "handoff_id": "synthetic-handoff-review-001",
  "rfq_id": "synthetic-rfq-ready-001",
  "created_by_actor_type": "human",
  "created_by_actor_id": "synthetic-sales-user",
  "status": "review_required",
  "quote": {
    "unit_price": 12.5,
    "currency": "USD",
    "moq": 100,
    "lead_time_days": 30,
    "payment_terms": "Synthetic terms",
    "validity_days": 30
  }
}
